{
  "assurance": {
    "clean_prompt_exact_content_allowed": true,
    "excluded_content_allowed": false,
    "local_spool_immutable": false,
    "production_admission": false,
    "raw_sensitive_content_allowed": false
  },
  "export": {
    "enabled": false,
    "endpoint": null,
    "persistent_queue": "collector-file-storage-not-configured",
    "protocol": "otlp/https"
  },
  "kind": "LocalGovernanceStatePolicy",
  "layout": {
    "authority_pin": "{project_id}/authority-pin/",
    "commit_guard_receipts": "{project_id}/commit-governance/",
    "linux": "/var/lib/kt-scaffold/governance/",
    "macos": "/Users/Shared/kt-scaffold/governance/",
    "prompt_receipts": "{project_id}/prompt-ingress/",
    "review_baselines": "{project_id}/review-baseline/",
    "windows": "%ProgramData%\\kt-scaffold\\governance\\"
  },
  "limits": {
    "max_authority_receipt_bytes": 65536,
    "max_commit_guard_event_bytes": 65536,
    "max_prompt_record_bytes": 262144,
    "max_review_baseline_file_bytes": 2097152
  },
  "metadata": {
    "version": "4.0.0"
  },
  "retention": {
    "automatic_delete": false,
    "delete_requires_export_ack": true
  },
  "schema_version": "1.0"
}
